Name,Description,Count,Health,Duration,Icons,Attack,Card Type
Encounter: Tempest,"Before the game begins, search the encounter deck for The Tempest and put it onto the field.
Before time passes, you lose the game if there is 8 or more ⏳ on The Tempest.
You are in the eye of the storm while The Tempest has is 4 ⏳ on it.",1,,,,,RULES CARD
The Tempest,"After you play an action, remove 1 ⏳ from The Tempest.
Add 1 ⏳ to The Tempest instead of removing it during the night's time passes step.
If The Tempest would be discarded, put 1 ⏳ on it instead.",1,,4,,,ELITE DURATION
Approaching Storm,"Before time passes, if there is less than 3 ⏳ on The Tempest, add ⏳ to it until there is 3 ⏳ on it. 
You can't remove ⏳ from The Tempest.",1,,2,,,DURATION
Storm's Maw,"If you are in the eye of the storm, this enemy does not attack during the night's attack step.
This enemy gets +X ❤️, where X is the number of ⏳ on The Tempest.",1,4,,,4,ELITE ENEMY
Gale Force Winds,"Before this card is discarded, add X ⏳ from The Tempest, where X is the number of cards on your field.",2,,2,,,DURATION
Funnel Clouds,"Before time passes, add 1 ⏳ from The Tempest.",2,,4,,,DURATION
Spout Kraken,"After this enemy attacks, remove 1 ⏳ from The Tempest.",2,5,,,2,ENEMY
Downpour,"Add 2 ⏳ to Tempest.
Shuffle this event into the Encounter deck.",3,,,,,EVENT
Fog Wraith,This enemy can't be dealt damage unless you are in the eye of the storm.,3,2,,,2,ENEMY