Name,Description,Count,Cost: Berries,Cost: Sticks,Cost: Stones,Cost: Flowers,Gives: Berries,Gives: Sticks,Gives: Stones,Gives: Flowers,Notes,Frequency
Harvest,Reap to heal X+1 damage.,2,1,,,1,1,,,,Uncommon 3,2
Thorny Vines,Reap to deal 1 damage to up to X things.,2,1,,,1,,,,1,Uncommon 3,2
Planting Season,Put the top two cards of your deck into play as resources for your partner.,1,1,1,,,1,,1,,Uncommon 1,2
Planting Season,Put the top two cards of your deck into play as resources for your partner.,1,1,,1,,1,1,,,Uncommon 1,2
Seed Bomb,Reap to deal X+1 damage.,1,,1,,1,,,1,1,Uncommon 2,2
Seed Bomb,Reap to deal X+1 damage.,1,,,1,1,,1,,1,Uncommon 2,2
Compost,Put all cards from your discard pile into play as resources for your partner.,1,1,1,1,1,,1,1,,Rare 1 (Multi),1
Garden's Revolt,Rotate any number of resources or actions.,1,2,,,2,1,,,1,Rare 2 (Super),1